{
  "schema_version": 1,
  "id": "embedding",
  "source": {
    "kind": "scene",
    "path": "res://scenes/language_models/embedding.tscn"
  },
  "load_order": 212,
  "menu": {
    "visible": true,
    "section": "language",
    "order": 62
  },
  "roles": [
    "language"
  ],
  "llm": {
    "type": "embedding"
  },
  "runtime": {},
  "display": {
    "category": "learn"
  }
}
